{
  "$schema": "./schema.json",
  "id": "trail",
  "tab": "Trail closure",
  "icon": "terrain",
  "title": "Regional trail closure notice",
  "context": "Parks and recreation alert page",
  "problemStatement": "Visitors need a fast, trustworthy closure notice before they travel, plus a safe alternative when plans change.",
  "audience": "Hikers checking conditions before traveling to a trailhead",
  "userGoal": "Quickly know whether the trail is open and what safer alternatives exist.",
  "businessGoal": "Prevent unsafe travel, reduce call volume, and communicate reopening criteria.",
  "contextDetails": [
    { "label": "Decision needed", "value": "- [ ] Confirm the closure message and preferred alternative trail.", "checkable": true },
    { "label": "Out of scope", "value": "Full trail map redesign, weather feeds, and emergency alerts." },
    { "label": "Contributors", "value": "Ranger team, parks communications, trail maintenance" }
  ],
  "items": [
    {
      "type": "Alert",
      "componentType": "Alert",
      "title": "North Ridge Trail is closed after storm damage",
      "content": "Downed trees and unstable footing make the upper trail unsafe. Crews are assessing repairs.",
      "annotations": [
        "Closure status and reason must be first, especially on mobile."
      ],
      "links": ["Safety advisory"]
    },
    {
      "type": "Alternative",
      "componentType": "Link card",
      "title": "Use Meadow Loop for a similar distance",
      "content": "Meadow Loop is open, 3.1 miles, moderate grade, and accessible from the same parking area.",
      "annotations": [
        "Offer a useful next step instead of ending at the warning."
      ],
      "links": ["Meadow Loop map"]
    },
    {
      "type": "Update path",
      "componentType": "Paragraph",
      "title": "Check back Friday after 3:00 PM",
      "content": "The next inspection update will confirm whether partial reopening is possible this weekend.",
      "annotations": [
        "Timestamp prevents stale-alert uncertainty."
      ],
      "links": ["Alert updates"]
    }
  ]
}
